{
  "schema": "walletwall.sp1-proving-archive.v2",
  "subject": {
    "circuitSystem": "groth16",
    "circuitVersion": "v6.1.0",
    "designation": "synthetic-fixture-not-a-designation",
    "programVKey": "0x5f5f5f5f5f5f5f5f5f5f5f5f5f5f5f5f5f5f5f5f5f5f5f5f5f5f5f5f5f5f5f5f",
    "verifier": {
      "version": "v6.1.0",
      "runtimeCodeKeccak": "0x5e5e5e5e5e5e5e5e5e5e5e5e5e5e5e5e5e5e5e5e5e5e5e5e5e5e5e5e5e5e5e5e",
      "verifierHash": "0xf60633aaf2c215d7bce2d4642900152750e66b77133075c734c14b51337d7c74"
    },
    "verifyingKey": {
      "file": "groth16_vk.bin",
      "sha256": "0xf60633aaf2c215d7bce2d4642900152750e66b77133075c734c14b51337d7c74",
      "bytes": 73
    }
  },
  "archive": {
    "file": "synthetic-safe.tar.gz",
    "format": "tar+gzip",
    "bytes": 5039,
    "sha256": "9823fe742e085aef484f620e30918aa690ed93249494e12c74d0e9b6fa98c15f",
    "acquiredAtUtc": "2026-01-01T00:00:00Z",
    "sourceUrl": "https://example.invalid/synthetic-safe.tar.gz",
    "sourceUrlRole": "PROVENANCE_ONLY"
  },
  "acquisitions": [
    {
      "host": "synthetic-host-a",
      "observedAtUtc": "2026-01-01T00:00:00Z",
      "bytes": 5039,
      "sha256": "9823fe742e085aef484f620e30918aa690ed93249494e12c74d0e9b6fa98c15f",
      "agreement": "AGREES"
    },
    {
      "host": "synthetic-host-b",
      "observedAtUtc": "2026-01-01T00:00:00Z",
      "bytes": 5039,
      "sha256": "9823fe742e085aef484f620e30918aa690ed93249494e12c74d0e9b6fa98c15f",
      "agreement": "AGREES"
    }
  ],
  "members": [
    {
      "path": "constraints.json",
      "bytes": 67,
      "sha256": "069a9d7de5cae36f44e84fe87d380c6aabd635fc890f2971820c67328321800a"
    },
    {
      "path": "extra/README.synthetic",
      "bytes": 54,
      "sha256": "697c7e18023dfe2a7cc84bc45d89eeadf406f3c70b81c45956aa074fcb751302"
    },
    {
      "path": "groth16_circuit.bin",
      "bytes": 1500,
      "sha256": "53d37ff587991eda597af93c5ab692a4cb195c4ed50e5be86cae41eb76faa479"
    },
    {
      "path": "groth16_pk.bin",
      "bytes": 3000,
      "sha256": "b935b1ff2ad0a23b1f6fcb0ecba77d517af2b5c48be253b3224a4156114fbb3c"
    },
    {
      "path": "groth16_vk.bin",
      "bytes": 73,
      "sha256": "f60633aaf2c215d7bce2d4642900152750e66b77133075c734c14b51337d7c74"
    }
  ],
  "metadata": [],
  "gnark": {
    "repository": "registry.invalid/walletwall/synthetic-gnark",
    "tag": "synthetic",
    "tagRole": "PROVENANCE_ONLY",
    "digest": "sha256:b0757af5c9362f7fe0f620bf90591d4552816594114a015cb334be9b964a138c",
    "observation": {
      "host": "synthetic-host-a",
      "observedAtUtc": "2026-01-01T00:00:00Z",
      "method": "synthetic fixture (no docker)"
    },
    "mirror": null
  },
  "mirrors": [
    {
      "location": "synthetic-mirror-a.invalid/synthetic-safe.tar.gz",
      "sha256": "9823fe742e085aef484f620e30918aa690ed93249494e12c74d0e9b6fa98c15f"
    },
    {
      "location": "synthetic-mirror-b.invalid/synthetic-safe.tar.gz",
      "sha256": "9823fe742e085aef484f620e30918aa690ed93249494e12c74d0e9b6fa98c15f"
    }
  ]
}
